{
  "schema_version": 1,
  "project_id": "order-utilities",
  "source_file": "project.txt",
  "source_sha256": "ccd9a47e4a6c788cbaa26513490bfc3fee6bc4a18ff5472074aee42e38d30cc8",
  "tasks": [
    {
      "id": "filter-alive-nodes",
      "input_file": "specs/filter-alive-nodes.txt",
      "output_file": "artifacts/FilterAliveNodes.lean",
      "depends_on": []
    },
    {
      "id": "elect-leader-by-max-id",
      "input_file": "specs/elect-leader-by-max-id.txt",
      "output_file": "artifacts/ElectLeaderByMaxId.lean",
      "depends_on": []
    },
    {
      "id": "count-votes-for-candidate",
      "input_file": "specs/count-votes-for-candidate.txt",
      "output_file": "artifacts/CountVotesForCandidate.lean",
      "depends_on": []
    },
    {
      "id": "has-majority",
      "input_file": "specs/has-majority.txt",
      "output_file": "artifacts/HasMajority.lean",
      "depends_on": []
    },
    {
      "id": "next-node-in-ring",
      "input_file": "specs/next-node-in-ring.txt",
      "output_file": "artifacts/NextNodeInRing.lean",
      "depends_on": []
    },
    {
      "id": "should-accept-term",
      "input_file": "specs/should-accept-term.txt",
      "output_file": "artifacts/ShouldAcceptTerm.lean",
      "depends_on": []
    }
  ]
}
